7,爵是一种典礼时用的酒器，那么爵有几只脚？,A:三只脚 B:四只脚,2,A,问题解析,"10,12",1,0,0
7,浪漫主义诗人济慈在世活了多少年,&lt;p&gt;A:太古代&lt;/p&gt;&lt;p&gt;B:古生代&lt;/p&gt;&lt;p&gt;C:元生代&lt;/p&gt;,4,B,问题解析,"4,5",2,0,0
7,焚书最多的皇帝是：,&lt;p&gt;A:太古代&lt;/p&gt;&lt;p&gt;B:古生代&lt;/p&gt;&lt;p&gt;C:元生代&lt;/p&gt;,4,C,问题解析,"6,7",3,0,0
7,历史上乐不思蜀的皇帝是：,&lt;p&gt;A:太古代&lt;/p&gt;&lt;p&gt;B:古生代&lt;/p&gt;&lt;p&gt;C:元生代&lt;/p&gt;,4,C,问题解析,"7,8",3,0,0
7,历史上曾有的风雨声对联在：,&lt;p&gt;A:太古代&lt;/p&gt;&lt;p&gt;B:古生代&lt;/p&gt;&lt;p&gt;C:元生代&lt;/p&gt;,4,C,问题解析,"8,9",1,0,0
7,临终前三呼过河的南宋抗金将领名将：,&lt;p&gt;A:太古代&lt;/p&gt;&lt;p&gt;B:古生代&lt;/p&gt;&lt;p&gt;C:元生代&lt;/p&gt;,4,D,问题解析,"9,10",1,0,0
7,旧金山金门大桥始建于哪一年：,&lt;p&gt;A:太古代&lt;/p&gt;&lt;p&gt;B:古生代&lt;/p&gt;&lt;p&gt;C:元生代&lt;/p&gt;,4,C,问题解析,"12,13",2,0,0
7,秦始皇以后，又有几个朝代对长城进行了修葺加固？,&lt;p&gt;A:太古代&lt;/p&gt;&lt;p&gt;B:古生代&lt;/p&gt;&lt;p&gt;C:元生代&lt;/p&gt;,4,B,问题解析,"13,14",3,0,0
7,日本历史上的平城京指的是现在的：,&lt;p&gt;A:太古代&lt;/p&gt;&lt;p&gt;B:古生代&lt;/p&gt;&lt;p&gt;C:元生代&lt;/p&gt;,4,C,问题解析,"4,5",2,0,0
7,牌楼是一种门洞式的纪念性和装饰性的建筑物。据史料记载，北京过去曾有多少座牌楼？,&lt;p&gt;A:太古代&lt;/p&gt;&lt;p&gt;B:古生代&lt;/p&gt;&lt;p&gt;C:元生代&lt;/p&gt;,4,A,问题解析,"5,10",3,0,0
7,艾菲尔出生于,&lt;p&gt;A:太古代&lt;/p&gt;&lt;p&gt;B:古生代&lt;/p&gt;&lt;p&gt;C:元生代&lt;/p&gt;,4,C,问题解析,"10,13,17",3,0,0
7,汉长安城的大街分三条道，中央御路宽约：,&lt;p&gt;A:太古代&lt;/p&gt;&lt;p&gt;B:古生代&lt;/p&gt;&lt;p&gt;C:元生代&lt;/p&gt;,4,A,问题解析,"4,5,8",1,0,0
7,塔传入中国是在什么时候？,&lt;p&gt;A:太古代&lt;/p&gt;&lt;p&gt;B:古生代&lt;/p&gt;&lt;p&gt;C:元生代&lt;/p&gt;,4,B,问题解析,"3,4,8",2,0,0
7,夜市最早出现在：,&lt;p&gt;A:太古代&lt;/p&gt;&lt;p&gt;B:古生代&lt;/p&gt;&lt;p&gt;C:元生代&lt;/p&gt;,4,D,问题解析,"5,10",2,0,0
7,世界七大奇迹建造时间最晚的是,&lt;p&gt;A:太古代&lt;/p&gt;&lt;p&gt;B:古生代&lt;/p&gt;&lt;p&gt;C:元生代&lt;/p&gt;,4,A,问题解析,17,2,0,0
7,彼得宫始建于什么世纪：,&lt;p&gt;A:太古代&lt;/p&gt;&lt;p&gt;B:古生代&lt;/p&gt;&lt;p&gt;C:元生代&lt;/p&gt;,4,C,问题解析,18,1,0,0
7,唐长安城大街植的行道树是,&lt;p&gt;A:太古代&lt;/p&gt;&lt;p&gt;B:古生代&lt;/p&gt;&lt;p&gt;C:元生代&lt;/p&gt;,4,C,问题解析,19,1,0,0
7,“巴黎公社”成立于哪一年的3月28日？,&lt;p&gt;A:太古代&lt;/p&gt;&lt;p&gt;B:古生代&lt;/p&gt;&lt;p&gt;C:元生代&lt;/p&gt;,4,A,问题解析,20,2,0,0
7,“白骨露于野，千里无鸡鸣”这一诗句所反映的时代是什么时期？,&lt;p&gt;A:太古代&lt;/p&gt;&lt;p&gt;B:古生代&lt;/p&gt;&lt;p&gt;C:元生代&lt;/p&gt;,4,B,问题解析,21,2,0,0
7,“百团大战”中八路军的指挥官是谁？,&lt;p&gt;A:太古代&lt;/p&gt;&lt;p&gt;B:古生代&lt;/p&gt;&lt;p&gt;C:元生代&lt;/p&gt;,4,B,问题解析,22,1,0,0
8,历史上著名的“澶渊之盟”发生在哪两朝之间？,&lt;p&gt;A:太古代&lt;/p&gt;&lt;p&gt;B:古生代&lt;/p&gt;&lt;p&gt;C:元生代&lt;/p&gt;,2,A,判断题解析,18,1,0,0
8,戊戌变法运动期间，维新派创办的第一份报纸是：,&lt;p&gt;A:太古代&lt;/p&gt;&lt;p&gt;B:古生代&lt;/p&gt;&lt;p&gt;C:元生代&lt;/p&gt;,2,B,判断题解析,18，13,2,0,0
8,我国古代有人口统计机构吗？,&lt;p&gt;A:太古代&lt;/p&gt;&lt;p&gt;B:古生代&lt;/p&gt;&lt;p&gt;C:元生代&lt;/p&gt;,2,B,判断题解析,15，14,3,0,0
8,鸿门宴上范增是用什么示意项羽下决心的？,&lt;p&gt;A:太古代&lt;/p&gt;&lt;p&gt;B:古生代&lt;/p&gt;&lt;p&gt;C:元生代&lt;/p&gt;,2,A,判断题解析,15,3,0,0
8,我国在何时将农历正月初一正式定名为春节？,&lt;p&gt;A:太古代&lt;/p&gt;&lt;p&gt;B:古生代&lt;/p&gt;&lt;p&gt;C:元生代&lt;/p&gt;,2,B,判断题解析,17,2,0,0
8,我国的科举制度始于那个朝代？,&lt;p&gt;A:太古代&lt;/p&gt;&lt;p&gt;B:古生代&lt;/p&gt;&lt;p&gt;C:元生代&lt;/p&gt;,2,A,判断题解析,18,1,0,0
8,在11月7日纪念俄国10月25日发生的“十月革命”，这样的差异与历法有关吗？,&lt;p&gt;A:太古代&lt;/p&gt;&lt;p&gt;B:古生代&lt;/p&gt;&lt;p&gt;C:元生代&lt;/p&gt;,2,B,判断题解析,19,2,0,0
8,古时称送考生入京师应会试的官车为“公车”，它是什么朝代的惯例？,&lt;p&gt;A:太古代&lt;/p&gt;&lt;p&gt;B:古生代&lt;/p&gt;&lt;p&gt;C:元生代&lt;/p&gt;,2,A,判断题解析,20,1,0,0
8,帮助商鞅在秦国人民中树立威信的是：,&lt;p&gt;A:太古代&lt;/p&gt;&lt;p&gt;B:古生代&lt;/p&gt;&lt;p&gt;C:元生代&lt;/p&gt;,2,B,判断题解析,"10,4",2,0,0
8,“老三届”指的是那几年毕业的初、高中毕业生？,&lt;p&gt;A:太古代&lt;/p&gt;&lt;p&gt;B:古生代&lt;/p&gt;&lt;p&gt;C:元生代&lt;/p&gt;,2,B,判断题解析,4,1,0,0
8,人类最古老的绘画形式是：,&lt;p&gt;A:太古代&lt;/p&gt;&lt;p&gt;B:古生代&lt;/p&gt;&lt;p&gt;C:元生代&lt;/p&gt;,2,B,判断题解析,1,2,0,0
8,最初使用的海洋捕捞工具是：,&lt;p&gt;A:太古代&lt;/p&gt;&lt;p&gt;B:古生代&lt;/p&gt;&lt;p&gt;C:元生代&lt;/p&gt;,2,B,判断题解析,3,2,0,0
8,谁第一次把中国话剧带进美国白宫？,&lt;p&gt;A:太古代&lt;/p&gt;&lt;p&gt;B:古生代&lt;/p&gt;&lt;p&gt;C:元生代&lt;/p&gt;,2,A,判断题解析,5,2,0,0
8,中国共产党的创始人李大钊是被什么人杀害的？,&lt;p&gt;A:太古代&lt;/p&gt;&lt;p&gt;B:古生代&lt;/p&gt;&lt;p&gt;C:元生代&lt;/p&gt;,2,B,判断题解析,7,2,0,0
8,第一套奥林匹克邮票是哪个国家发行的,&lt;p&gt;A:太古代&lt;/p&gt;&lt;p&gt;B:古生代&lt;/p&gt;&lt;p&gt;C:元生代&lt;/p&gt;,2,A,判断题解析,8,3,0,0
4,请问人类最先使用下列哪种金属制造器具？,,,答案,定值填空解析,7,1,0,0
4,北约（），成立于年4月4日。,,,答案,定值填空解析,8,2,0,0
4,司马光，司马迁，司马昭，司马懿，那位司马先生出生最早（）,,,答案,定值填空解析,9,3,0,0
4,马王堆一号古墓是（）朝代,,,答案,定值填空解析,10,1,0,0
4,中国古代兵法（）中，不含下面哪一韬,,,答案,定值填空解析,11,2,0,0
4,马王堆一号古墓是（）朝代,,,答案,定值填空解析,12,2,0,0
4,你知道世界上第一辆汽车是（）制造的吗？,,,答案,定值填空解析,12,2,0,0
4,“全聚德”是著名的“中华老字号”，以经营果木挂炉烤鸭和深厚的饮食文化闻名海内外。你知道“全聚德”始建于（）吗？,,,答案,定值填空解析,"13,14",1,0,0
4,下半旗致哀最早是从那（）始使用并流传开的,,,答案,定值填空解析,14,2,0,0
4,建国以后，为了保卫祖国的领土完整，我们共进行了（）边境自卫反击战,,,答案,定值填空解析,14,1,0,0
4,我国有三块举世闻名无字碑，请问都是为（）所立。,,,答案,定值填空解析,15,1,0,0
4,“猎头”公司大家可能都听说过，是创建于美国专门为第三方挖掘人才的，那么你知道它最早来源（）吗？,,,答案,定值填空解析,16,1,0,0
4,朱熹是（）朝代著名的文学家、理学家？,,,答案,定值填空解析,17,2,0,0
4,张学良东北易帜发生于（）,,,答案,定值填空解析,18,2,0,0
4,作为新乐府运动的主将，倡导关注现实，诗风明快晓畅的唐代大诗人是（）？,,,答案,定值填空解析,19,3,0,0
6,“红巾军”起义发生在哪个朝代的末期？,,,简答题答案,简答题解析,4,2,0,0
6,从商代甲骨文中可以看到,,,简答题答案,简答题解析,1,2,0,0
6,下列人物未曾经历过三国时期的是,,,简答题答案,简答题解析,3,2,0,0
6,我国以煤为燃料冶铁始于,,,简答题答案,简答题解析,5,2,0,0
6,杨坚建立隋朝的方式是,,,简答题答案,简答题解析,7,3,0,0
6,4世纪下半期统一黄河流域的政权是哪个少数民族建立的,,,简答题答案,简答题解析,8,1,0,0
6,满族的前身是女真族吗？,,,简答题答案,简答题解析,7,2,0,0
6,文章西汉两司马，经世南北一卧龙是指,,,简答题答案,简答题解析,8,3,0,0
6,四大名楼不包括,,,简答题答案,简答题解析,9,1,0,0
6,四大名楼不包括,,,简答题答案,简答题解析,10,2,0,0
6,陶渊明（365,,,简答题答案,简答题解析,11,2,0,0
6,十字军东侵是罗马史上重要的一页，十字军是罗马教廷为建立世界教会而组织起来的，十字军远征持续了将近200年，罗马教廷建立世界教会的企图不仅完全落空，而且由于其侵略暴行和本来的罪恶面目，使教会的威信大为下降。请问，十字军共举行了几次,,,简答题答案,简答题解析,12,2,0,0
6,88式主站坦克哪一年装备韩国部队？,,,简答题答案,简答题解析,12,1,0,0
6,1937年1月，红军大学改称抗日军政大学，谁任校长兼政委？,,,简答题答案,简答题解析,"13,14",2,0,0
6,周朝灭亡商朝是下面哪一战？,,,简答题答案,简答题解析,14,1,0,0
6,波斯是古代哪里的一个奴隶制国家？,,,简答题答案,简答题解析,14,1,0,0
6,明朝末年，多尔衮趁李自成义军渐渐腐化，利用吴三桂引兵入关，用的是什么计谋？,,,简答题答案,简答题解析,15,1,0,0
6,社会保障基金来源于：,,,简答题答案,简答题解析,16,2,0,0
6,SARS指的是：,,,简答题答案,简答题解析,17,2,0,0
6,邹忌是哪国人？,,,简答题答案,简答题解析,18,3,0,0
